{
  "schemaVersion": "1.0.0",
  "ttsSegmentAudioId": "tsa-c0989aba0700",
  "version": 1,
  "projectId": "phase7-gps-explainer",
  "scriptRef": {
    "scriptArtifactId": "fss-phase7-gps-explainer",
    "scriptVersion": 2
  },
  "segmentId": "N25",
  "segmentOrdinal": 25,
  "sourceTextHash": "accb0a6cb7f6c4e7",
  "compiledInputHash": "accb0a6cb7f6c4e7",
  "voiceBibleRef": "vb-19f4fd6a4596",
  "narrationDirectionRef": "nd-7bd74d759a3c",
  "pronunciationPassRef": "prp-f6b2f490d97d",
  "provider": "local-kokoro",
  "providerModel": "kokoro-v1",
  "runtimeIdentity": {
    "runtimeMode": "LOCAL_SYNTHESIS",
    "modelRepo": "hexgrad/Kokoro-82M",
    "modelHash": "UNKNOWN_NOT_AVAILABLE",
    "languageCode": "a"
  },
  "voiceId": "am_michael",
  "effectiveSpeed": 1,
  "pacePolicyVersion": "pace-speed-1.0.0",
  "audioRef": "assets/voice/narration-segments/tsa-c0989aba0700.wav",
  "audioContentHash": "1c7c5fd3aa61140bf528b904c7c1c725157127f0e84a881a0bd5eb0047ea516c",
  "durationMs": 21600,
  "sampleRate": 24000,
  "channels": 1,
  "technicalQa": {
    "decodePass": true,
    "nonSilent": true,
    "finiteSamples": true,
    "peak": 18620,
    "rms": 1346.42,
    "clippingSamples": 0,
    "transcript": "Between the satellite and your phone, the signal crosses the ionosphere and the troposphere, and both add delay. Dry air alone adds about 2.3 meters straight overhead and about 10 meters for satellites low on the horizon. Water vapor adds only tens of centimeters, but it changes quickly and is hard to model.",
    "wer": 0.0727,
    "missingWords": 1,
    "substitutedWords": 3,
    "repeatedWords": 0,
    "hallucinatedWords": 0,
    "criticalMismatch": false
  },
  "attempt": {
    "number": 1,
    "parentAttemptId": null,
    "reason": "initial synthesis",
    "selected": null
  },
  "issues": [],
  "status": "READY",
  "provenance": {
    "createdAt": "2026-10-12T04:28:22.111Z",
    "evidenceRefs": []
  },
  "fingerprint": "4f8c3419a5bf4c9b"
}
