{
  "schemaVersion": "1.0.0",
  "ttsSegmentAudioId": "tsa-a6849825636c",
  "version": 1,
  "projectId": "phase7-gps-explainer",
  "scriptRef": {
    "scriptArtifactId": "fss-phase7-gps-explainer",
    "scriptVersion": 2
  },
  "segmentId": "N31",
  "segmentOrdinal": 31,
  "sourceTextHash": "ae93a5d2da86c415",
  "compiledInputHash": "8d599db19189d522",
  "voiceBibleRef": "vb-19f4fd6a4596",
  "narrationDirectionRef": "nd-7bd74d759a3c",
  "pronunciationPassRef": "prp-f6b2f490d97d",
  "provider": "local-kokoro",
  "providerModel": "kokoro-v1",
  "runtimeIdentity": {
    "runtimeMode": "LOCAL_SYNTHESIS",
    "modelRepo": "hexgrad/Kokoro-82M",
    "modelHash": "UNKNOWN_NOT_AVAILABLE",
    "languageCode": "a"
  },
  "voiceId": "am_michael",
  "effectiveSpeed": 1,
  "pacePolicyVersion": "pace-speed-1.0.0",
  "audioRef": "assets/voice/narration-segments/tsa-a6849825636c.wav",
  "audioContentHash": "0e7b47924092a2c8c4e2ad23aa151e64cc002ee91064ab8efd7452c2f56aa156",
  "durationMs": 10700,
  "sampleRate": 24000,
  "channels": 1,
  "technicalQa": {
    "decodePass": true,
    "nonSilent": true,
    "finiteSamples": true,
    "peak": 20134,
    "rms": 1400.11,
    "clippingSamples": 0,
    "transcript": "Engineers push further. Augmentation systems add corrections. WAS, run by the FAA, helps aircraft navigate across North America.",
    "wer": 0.0556,
    "missingWords": 0,
    "substitutedWords": 1,
    "repeatedWords": 0,
    "hallucinatedWords": 0,
    "criticalMismatch": false
  },
  "attempt": {
    "number": 1,
    "parentAttemptId": null,
    "reason": "initial synthesis",
    "selected": null
  },
  "issues": [],
  "status": "READY",
  "provenance": {
    "createdAt": "2026-10-12T04:30:38.272Z",
    "evidenceRefs": []
  },
  "fingerprint": "7d92d5531c109743"
}
