{
  "schemaVersion": "1.0.0",
  "ttsSegmentAudioId": "tsa-33f94c277574",
  "version": 1,
  "projectId": "phase7-gps-explainer",
  "scriptRef": {
    "scriptArtifactId": "fss-phase7-gps-explainer",
    "scriptVersion": 2
  },
  "segmentId": "N18",
  "segmentOrdinal": 17,
  "sourceTextHash": "b8ff653392fae08f",
  "compiledInputHash": "b8ff653392fae08f",
  "voiceBibleRef": "vb-19f4fd6a4596",
  "narrationDirectionRef": "nd-7bd74d759a3c",
  "pronunciationPassRef": "prp-f6b2f490d97d",
  "provider": "local-kokoro",
  "providerModel": "kokoro-v1",
  "runtimeIdentity": {
    "runtimeMode": "LOCAL_SYNTHESIS",
    "modelRepo": "hexgrad/Kokoro-82M",
    "modelHash": "UNKNOWN_NOT_AVAILABLE",
    "languageCode": "a"
  },
  "voiceId": "am_michael",
  "effectiveSpeed": 1,
  "pacePolicyVersion": "pace-speed-1.0.0",
  "audioRef": "assets/voice/narration-segments/tsa-33f94c277574.wav",
  "audioContentHash": "663578b41ab36036bfc3545c44b150e445d090a57cb8e4d806d524001fa5e71e",
  "durationMs": 18625,
  "sampleRate": 24000,
  "channels": 1,
  "technicalQa": {
    "decodePass": true,
    "nonSilent": true,
    "finiteSamples": true,
    "peak": 17800,
    "rms": 1359.47,
    "clippingSamples": 0,
    "transcript": "General relativity says clocks tick faster where gravity is weaker. Up there, that adds about 45 microseconds a day. Combined with the effect of motion, an uncorrected satellite clock would run about 38 microseconds a day faster than one on the ground.",
    "wer": 0.0909,
    "missingWords": 2,
    "substitutedWords": 2,
    "repeatedWords": 0,
    "hallucinatedWords": 0,
    "criticalMismatch": false
  },
  "attempt": {
    "number": 1,
    "parentAttemptId": null,
    "reason": "initial synthesis",
    "selected": null
  },
  "issues": [],
  "status": "READY",
  "provenance": {
    "createdAt": "2026-10-12T04:24:52.318Z",
    "evidenceRefs": []
  },
  "fingerprint": "e934fc8b90ad5fe9"
}
