{
  "schemaVersion": "1.0.0",
  "ttsSegmentAudioId": "tsa-78d74668fb65",
  "version": 1,
  "projectId": "phase7-gps-explainer",
  "scriptRef": {
    "scriptArtifactId": "fss-phase7-gps-explainer",
    "scriptVersion": 2
  },
  "segmentId": "N23",
  "segmentOrdinal": 23,
  "sourceTextHash": "902d5d2d81150b4b",
  "compiledInputHash": "902d5d2d81150b4b",
  "voiceBibleRef": "vb-19f4fd6a4596",
  "narrationDirectionRef": "nd-7bd74d759a3c",
  "pronunciationPassRef": "prp-f6b2f490d97d",
  "provider": "local-kokoro",
  "providerModel": "kokoro-v1",
  "runtimeIdentity": {
    "runtimeMode": "LOCAL_SYNTHESIS",
    "modelRepo": "hexgrad/Kokoro-82M",
    "modelHash": "UNKNOWN_NOT_AVAILABLE",
    "languageCode": "a"
  },
  "voiceId": "am_michael",
  "effectiveSpeed": 1,
  "pacePolicyVersion": "pace-speed-1.0.0",
  "audioRef": "assets/voice/narration-segments/tsa-78d74668fb65.wav",
  "audioContentHash": "fc5f5222c572114fddcef0c773d6350441628723cf4802f839014fb9ca10ed64",
  "durationMs": 13000,
  "sampleRate": 24000,
  "channels": 1,
  "technicalQa": {
    "decodePass": true,
    "nonSilent": true,
    "finiteSamples": true,
    "peak": 16168,
    "rms": 1333.72,
    "clippingSamples": 0,
    "transcript": "The receiver makes the same pattern and slides it until the two match. That shift is how late the signal arrived by the receiver's own clock. That is why the result is called a suitoring.",
    "wer": 0.0286,
    "missingWords": 0,
    "substitutedWords": 1,
    "repeatedWords": 0,
    "hallucinatedWords": 0,
    "criticalMismatch": false
  },
  "attempt": {
    "number": 1,
    "parentAttemptId": null,
    "reason": "initial synthesis",
    "selected": null
  },
  "issues": [],
  "status": "READY",
  "provenance": {
    "createdAt": "2026-10-12T04:27:16.106Z",
    "evidenceRefs": []
  },
  "fingerprint": "b1d0b57c8e7d47f4"
}
