{
  "schemaVersion": "1.0.0",
  "ttsSegmentAudioId": "tsa-87c0ecaa1fb8",
  "version": 1,
  "projectId": "pilot-sky-blue",
  "scriptRef": {
    "scriptArtifactId": "fss-pilot-sky-blue",
    "scriptVersion": 2
  },
  "segmentId": "S5",
  "segmentOrdinal": 4,
  "sourceTextHash": "f476e57583e6a499",
  "compiledInputHash": "f476e57583e6a499",
  "voiceBibleRef": "vb-19f4fd6a4596",
  "narrationDirectionRef": "nd-ba9e14b889f3",
  "pronunciationPassRef": "prp-ef2591fc81ec",
  "provider": "local-kokoro",
  "providerModel": "kokoro-v1",
  "runtimeIdentity": {
    "runtimeMode": "LOCAL_SYNTHESIS",
    "modelRepo": "hexgrad/Kokoro-82M",
    "modelHash": "UNKNOWN_NOT_AVAILABLE",
    "languageCode": "a"
  },
  "voiceId": "am_michael",
  "effectiveSpeed": 1,
  "pacePolicyVersion": "pace-speed-1.0.0",
  "audioRef": "assets/voice/narration-segments/tsa-87c0ecaa1fb8.wav",
  "audioContentHash": "c5950053f2b1f20fc39a077bfdcb3a13e68a6e70ab9a5bc96bcd5766833e21f3",
  "durationMs": 8300,
  "sampleRate": 24000,
  "channels": 1,
  "technicalQa": {
    "decodePass": true,
    "nonSilent": true,
    "finiteSamples": true,
    "peak": 18257,
    "rms": 1311.41,
    "clippingSamples": 0,
    "transcript": "Violet gets scattered even more, but there is less of it in sunlight to begin with, and your eyes are less sensitive to it.",
    "wer": 0,
    "missingWords": 0,
    "substitutedWords": 0,
    "repeatedWords": 0,
    "hallucinatedWords": 0,
    "criticalMismatch": false
  },
  "attempt": {
    "number": 1,
    "parentAttemptId": null,
    "reason": "initial synthesis",
    "selected": null
  },
  "issues": [],
  "status": "READY",
  "provenance": {
    "createdAt": "2026-10-06T06:52:02.780Z",
    "evidenceRefs": [
      "scripts/cli/pilot-narration.js"
    ]
  },
  "fingerprint": "047c6b53c6b3e3d1"
}
