{
  "schemaVersion": "1.0.0",
  "ttsSegmentAudioId": "tsa-e32cb5c209cc",
  "version": 1,
  "projectId": "phase7-gps-explainer",
  "scriptRef": {
    "scriptArtifactId": "fss-phase7-gps-explainer",
    "scriptVersion": 2
  },
  "segmentId": "N30",
  "segmentOrdinal": 30,
  "sourceTextHash": "2b7126208f6b844c",
  "compiledInputHash": "2b7126208f6b844c",
  "voiceBibleRef": "vb-19f4fd6a4596",
  "narrationDirectionRef": "nd-7bd74d759a3c",
  "pronunciationPassRef": "prp-f6b2f490d97d",
  "provider": "local-kokoro",
  "providerModel": "kokoro-v1",
  "runtimeIdentity": {
    "runtimeMode": "LOCAL_SYNTHESIS",
    "modelRepo": "hexgrad/Kokoro-82M",
    "modelHash": "UNKNOWN_NOT_AVAILABLE",
    "languageCode": "a"
  },
  "voiceId": "am_michael",
  "effectiveSpeed": 1,
  "pacePolicyVersion": "pace-speed-1.0.0",
  "audioRef": "assets/voice/narration-segments/tsa-e32cb5c209cc.wav",
  "audioContentHash": "b8804d6d81f884fa05a8ed0c567a16ccb943ea948c82cf0e9d003abd3af7a114",
  "durationMs": 15950,
  "sampleRate": 24000,
  "channels": 1,
  "technicalQa": {
    "decodePass": true,
    "nonSilent": true,
    "finiteSamples": true,
    "peak": 13517,
    "rms": 1333.16,
    "clippingSamples": 0,
    "transcript": "It used to be worse by design. Until May 2000, the United States deliberately degraded the public GPS signal for national security reasons. Then it turned that feature off and says it has no intent to use it again.",
    "wer": 0,
    "missingWords": 0,
    "substitutedWords": 0,
    "repeatedWords": 0,
    "hallucinatedWords": 0,
    "criticalMismatch": false
  },
  "attempt": {
    "number": 1,
    "parentAttemptId": null,
    "reason": "initial synthesis",
    "selected": null
  },
  "issues": [],
  "status": "READY",
  "provenance": {
    "createdAt": "2026-10-12T04:30:18.345Z",
    "evidenceRefs": []
  },
  "fingerprint": "ba69f6553b9114dd"
}
